Directed Numbers,cLP7INqs3JM,So let's talk a little bit
,,about rational numbers. And the simple way to think
,,about it is any number that can be represented as
,,"the ratio of two integers is a rational number. So for example, any integer"
,,is a rational number. 1 can be represented as 1/1 or
,,"as negative 2 over negative 2 or as 10,000/10,000. In all of these cases, these are   "
,,"all different representations of the number 1,"
,,ratio of two integers. And I obviously can
,,have an infinite number of representations
,,"of 1 in this way, the same number over"
,,the same number. The number negative 7 could be
,,"represented as negative 7/1, or 7 over negative 1, or"
,,"negative 14 over positive 2. And I could go on, and"
,,"on, and on, and on. So negative 7 is definitely"
,,a rational number. It can be represented as
,,the ratio of two integers. But what about things
,,"that are not integers? For example, let us imagine--"
,,"oh, I don't know-- 3.75. How can we represent that as"
,,"the ratio of two integers? Well, 3.75, you"
,,"could rewrite that as 375/100, which is the"
,,"same thing as 750/200. Or you could say, hey,"
,,3.75 is the same thing as 3 and 3/4-- so let
,,me write it here-- which is the same
,,"thing as-- that's 15/4. 4 times 3 is 12, plus 3 is"
,,"15, so you could write this. This is the same thing as 15/4. Or we could write this as"
,,negative 30 over negative 8. I just multiplied the
,,"numerator and the denominator here by negative 2. But just to be clear,"
,,this is clearly rational. I'm giving you multiple
,,examples of how this can be represented as
,,"the ratio of two integers. Now, what about"
,,"repeating decimals? Well, let's take"
,,"maybe the most famous of the repeating decimals. Let's say you have 0.333, just"
,,"keeps going on and on forever, which we can denote by"
,,putting that little bar on top of the 3. This is 0.3 repeating. And we've seen--
,,and later we'll show how you can convert
,,any repeating decimal as the ratio of two integers--
,,this is clearly 1/3. Or maybe you've seen things like
,,"0.6 repeating, which is 2/3. And there's many, many,"
,,many other examples of this. And we'll see any
,,"repeating decimal, not just one digit repeating. Even if it has a million"
,,"digits repeating, as long as the pattern"
,,starts to repeat itself over and over and
,,"over again, you can always represent that as"
,,the ratio of two integers. So I know what you're
,,"probably thinking. Hey, Sal, you've"
,,just included a lot. You've included all
,,of the integers. You've included all of finite
,,"non-repeating decimals, and you've also included"
,,repeating decimals. What is left? Are there any numbers
,,that are not rational? And you're probably
,,"guessing that there are, otherwise people"
,,wouldn't have taken the trouble of trying to
,,label these as rational. And it turns out-- as you
,,can imagine-- that actually some of the most famous
,,numbers in all of mathematics are not rational. And we call these numbers
,,irrational numbers. And I've listed there
,,just a few of the most noteworthy examples. Pi-- the ratio of
,,the circumference to the diameter of a circle--
,,is an irrational number. It never terminates. It goes on and on and on
,,"forever, and it never repeats. e, same thing-- never"
,,"terminates, never repeats. It comes out of continuously"
,,compounding interest. It comes out of
,,"complex analysis. e shows up all over the place. Square root of 2,"
,,"irrational number. Phi, the golden ratio,"
,,irrational number. So these things that
,,"really just pop out of nature, many of these"
,,"numbers are irrational. Now, you might say, OK,"
,,are these irrational? These are just these
,,special kind of numbers. But maybe most
,,"numbers are rational, and Sal's just picked out"
,,some special cases here. But the important thing to
,,"realize is they do seem exotic, and they are exotic"
,,in certain ways. But they aren't uncommon. It actually turns out
,,that there is always an irrational number between
,,"any two rational numbers. Well, we could go on and on. There's actually"
,,"an infinite number. But there's at least one,"
,,so that gives you an idea that you can't
,,really say that there are fewer irrational numbers
,,than rational numbers. And in a future
,,"video, we'll prove that you give me two rational"
,,"numbers-- rational 1, rational 2-- there's going to be"
,,"at least one irrational number between those, which"
,,"is a neat result, because irrational"
,,numbers seem to be exotic. Another way to think about it--
,,"I took the square root of 2, but you take the square root"
,,"of any non-perfect square, you're going to end up"
,,with an irrational number. You take the sum
,,of an irrational and a rational number-- and
,,we'll see this later on. We'll prove it to ourselves. The sum of an irrational
,,and a rational is going to be irrational. The product of an
,,"irrational and a rational is going to be irrational. So there's a lot, a lot, a"
,,lot of irrational numbers out there.
,,
Directed Numbers,C38B33ZywWs,Welcome to the presentation
,,on adding and subtracting negative numbers. So let's get started. So what is a negative
,,"number, first of all? Well, let me draw"
,,a number line. Well it's not much of a
,,line but I think you'll get the picture. So we're used to the positive
,,"numbers, so if that's 0, you have 1, you have 2, you have 3,"
,,"you have 4, and you keep going. And if I were to say what's 2"
,,"plus 2, you'd start at 2 and then you'd add 2 and"
,,you'd get to 4. I mean most of us
,,it's second nature. But if you actually drew
,,it on a number line you'd say 2 plus 2 is 4. And if I asked you what's
,,2 minus 1 or let's say what's 3 minus 2? If you start at 3 and
,,"you subtracted 2, you would end up at 1. That's 2 plus 2 is equal to 4"
,,and 3 minus 2 is equal to 1. And this is a joke for you. Now what if I were to
,,"say what is 1 minus 3? Huh. Well, it's the same thing. You start at 1 and we're going"
,,"to go 1 -- well, now we're going to go below 0 --"
,,what happens below 0? Well then you start going
,,"to the negative numbers. Negative 1, negative 2,"
,,"negative 3, and so on. So if I start at 1 right here,"
,,"so 1 minus 3, so I go 1, 2, 3, I end up at negative 2. So 1 minus 3 is equal"
,,to negative 2. This is something that you're
,,"probably already doing in your everyday life. If I were to tell you that boy,"
,,"it's very cold today, it's 1 degree, but tomorrow it's going"
,,"to be 3 degrees colder, you might already know intuitively,"
,,well then we're going to be at a temperature of
,,negative 2 degrees. So that's all a
,,negative number means. And just remember when a
,,"negative number is big, so like negative 50, that's actually"
,,"colder than negative 20, right? So a negative 50 is actually"
,,even a smaller number than negative 20 because it's even
,,further to the left of negative 20. That's just something you'll
,,get an intuitive feel for. Sometimes when you start you
,,"feel like oh, 50's a bigger number than 20, but it's a"
,,"negative 50 as opposed to a positive 50. So let's do some problems, and"
,,I'm going to keep using the number line because I
,,think it's useful. So let's do the
,,problem 5 minus 12. I think you already might
,,have an intuition of what this equals. But let me draw a
,,"line, 5 minus 12. So let me start with minus 10,"
,,"minus 9, minus 8 --I think I'm going to run out of space --"
,,"minus 7, minus 6, minus 5 -- I should have this pre-drawn --"
,,"minus 4, minus 3, minus 2, minus 1, 0, 1, 2, 3, 4,"
,,I'll put 5 right here. 5 minus 12. So if we start at 5 -- let me
,,use a different color -- we start at 5 right here and we're
,,"going to go to the left 12 because we're subtracting 12. So then we go 1, 2, 3, 4,"
,,"5, 6, 7, 8, 9, 10, 11, 12. Negative 7. That's pretty interesting. Because it also happens"
,,"to be that 12 minus 5 is equal to positive 7. So, I want you to think a"
,,little bit about why that is. Why the difference between 12
,,"and 5 is 7, and the difference between -- well, I"
,,guess it's either way. Because in this situation we're
,,"also saying that the difference between 5 and 12 is negative 7,"
,,"but the numbers are that far apart, but now we're starting"
,,with the lower number. I think that last sentence just
,,"completely confused you, but we'll keep moving forward. We just said 5 minus 12"
,,is equal to minus 7. Let's do another one. What's negative 3
,,"plus 5 equals what? Well, let's use the"
,,same number line. Let's go to negative 3 plus 5. So we're going to
,,"go to the right 5. 1, 2, 3, 4, 5. It's a 2. It equals 2. So negative 3 plus"
,,5 is equal to 2. That's interesting because 5
,,"minus 3 is also equal to 2. Well, it turns out that 5 minus"
,,"3 is the same thing, it's just another way of writing 5"
,,"plus negative 3 or negative 3 plus 5. A general, easy way to always"
,,do negative numbers is it's just like regular subtraction
,,"and addition and subtraction, but now when we subtract we"
,,can go to the left below 0. Let's do another one. So what happens when you get
,,"let's say 2 minus minus 3? Well, if you think about how"
,,it should work out I think this will make sense. But it turns out that the
,,"negative number, the negative signs actually cancel out. So this is the same thing"
,,"as 2 plus plus 3, and that just equals 5. Another way you could say is --"
,,let's do another one -- what is negative 7 minus minus 2? Well that's the same thing
,,"as negative 7 plus 2. And remember, so we're doing to"
,,start at negative 7 and we're going to move two to the right. So if we move one to the right
,,"we go to negative 6, and then we move two to the right"
,,we get negative 5. That makes sense because
,,"negative 7 plus 2, that's the same thing as 2 minus 7. If it's 2 degrees and it gets 7"
,,"degrees colder, it's minus 5. Let's do a bunch of these. I think the more you do the"
,,"more practice you have, and the modules explain it pretty well,"
,,probably better than I do. So let's just do a
,,ton of problems. So if I said
,,"negative 7 minus 3. Well, now we're going"
,,to go three to the left of negative 7. We're going to get 3 less
,,"than negative 7 so that's negative 10, right? That makes sense, because if we"
,,had positive 7 plus 3 we're at 7 to the right of 0 and we're
,,going to go three more to the right of 0 and we
,,get positive 10. So for 7 to the left of 0 and
,,go three more to the left we're going to get negative 10. Let's do a bunch more. I know I'm probably confusing
,,"you, but practice is what's going to really help us. So say 3 minus minus 3, well,"
,,"these negatives cancel out so that just equals 6. What's 3 minus 3? Well, that's easy"
,,that's just 0. What's minus 3 minus 3? Well now we're going to get
,,"three less than minus 3, well that's minus is 6. What's minus 3 minus minus 3? Interesting. Well, the minuses cancel out"
,,"so you get minus 3 plus 3. Well, if we start three to the"
,,"left of 0 and we move three to the right we end up at 0 again. So that makes sense, right? Let me do that again. Minus 3 minus minus 3. Anything minus itself        "
,,"should equal 0, right? That's why that equals 0. And that's why it makes sense"
,,that those two negatives cancel out and that's
,,"the same thing as this. Let's do a bunch more. Let's do 12 minus 13. That's pretty easy. Well, 12 minus 12 is 0, so"
,,12 minus 13 is negative 1 because we're going to
,,"go one the left of 0. Let's do 8 minus 5. Well, this one is just a"
,,"normal problem, that's 3. What's 5 minus 8? Well, we're going to go all the"
,,"way to 0 and then 3 more to the left of zero, so it's minus 3. I could draw a"
,,"number line here. If this is 0 this is 5, and now"
,,"we're going to go to left 8, then we end up and negative 3. You could do that"
,,for all of these. That actually might
,,be a good exercise. I think this will give you good
,,introduction and I recommend that you just do the modules
,,"because the modules actually, especially if you do the hints,"
,,it has a pretty nice graphic that's a lot nicer than
,,anything I could draw on this chalkboard. So try that out and I'm going
,,to try to record some more modules that hopefully won't
,,confuse you as badly. You could also attend the
,,seminar on adding and subtracting negative numbers. I hope you have fun. Bye.
,,
Directed Numbers,qW-Ce44ll0Q,#NAME?
,,"number lines here, and on each number line they mark off a couple of these marks,"
,,"this is negative two this is negative 10,"
,,"negative five, negative 11, and then we need to figure out"
,,"what the blue dot represents. And as a little bit of a hint, each mark here is not"
,,"necessarily incrementing by one, it could be by more than one. So I encourage you to pause this video, and to try it on your own. Try to figure out what number      "
,,does this blue dot represent on these different number lines? So let's tackle this first one. So we're gonna go where
,,"they gave us this mark is negative two, this is negative 10, and we need to figure out this blue one that's further to the left of negative 10. Well just going from "
,,"negative two to negative 10, what has to happen to negative"
,,"two to get to negative 10? Well we'll have to subtract eight. And so if we move two to the left, that's the equivalent"
,,"of subtracting eight. So if we move two to the left again, that's subtracting eight again. So this must be negative 18 and so if we move two to the left again, that "
,,"also must be subtracting eight. Negative 18 minus eight,"
,,"would get us to negative, that gets us to negative 26. Now another way we could"
,,"have thought about it is, if we jump two to the left"
,,"and that's negative eight, then one jump to the left"
,,"is gonna be negative four. So you could say ""Well"
,,"this is negative four"", that would get you to negative six, then negative four again"
,,"gets you to negative 10, then this would be"
,,"negative 14, negative 18, negative 22, negative 26. Now let's tackle this one. So here we're gonna, we have to figure out what this blue dot here is on the right. So if we started at 11, you make two jumps to go to negative five. So what do I have to add to negative 11 to get to negative five? Well I have to add six. So if I add six over two jumps, that means that each of these jumps, that must be plus three, and this one must be plus three. So now each mark we just add three. So negative five plus three... So plus three is gonna"
,,"get us to negative two. Plus three gets us to positive one, negative two plus three is positive one, plus three gets us to four. So here we got to negative 26, here "
,,"we get to four. Now let's tackle this one. So we're at negative seven, or this is negative seven this is one and then we have to figure"
,,"out this mark right over here. So if you take two jumps to the right, from negative seven to one, how much did we have to add? Well to get from negative seven to one, you have to add eight. You have to add eight. So then if we make another two"
,,jumps to the mystery number that means we added eight again. So one plus eight is nine. Another way we could
,,"have thought about it, if we added eight over two jumps that means we added four on each jump. So this one must be negative three, add four you get to one, add four "
,,"you get to five, add four you get to nine."
,,
Directed Numbers,jVvvUiExjes,in this video we're going to focus on adding and subtracting integers but in the first half we're just going to focus on adding integers let's start with something simple what is 3 plus 5 intuitively you know what the answer is but let's say if you didn't know what to do here's what you can do you can use a number line to help you add and subtract numbers so let's say this is 0 and we're going to start with 3 so start with the first number anytime you need to add travel on the right using the number line if you need to subtract then move towards the left so we wish to add 5 to 3 so we have to travel 5 spaces to the right 1 2 3 4 5 this is 4 5 6 7 8 that's where we ended up so three plus five is eight let's work on another example 4 plus 3 so if we start with 4 and if we travel three spaces to the right this is going to be 5 6 7 so therefore 4 plus 3 is equal to 7 and so using a number line is very helpful you will never need to add or subtract two integers is another example 
,,what is 8 plus negative 5 by the way 8 plus negative 5 is equivalent to 8 minus 5 if you wish to add a negative number start with the first number 8 add in a negative number you need to travel towards the left so 1 2 3 4 5 this is 7 6 5 4 3 so 8 plus negative 5 is positive 3 that's the same as 8 minus 5 which will give you the same answer now what about this one what is 7 plus negative 2 so for you to pause the video and try that so if we start with 7 all we need to do is travel two spaces 
,,to the left so this is 6 and this is 5 7 plus negative 2 is the same as 7 minus 2 which is 5 a positive times a negative will give you a negative sign if you multiply two positive signs this will give you a positive number if you multiply two negative numbers you will get a positive number but if you multiply a positive and the 
,,negatives together it will give you a negative number let's work on some more examples what is negative 6 plus 4 and what is negative 7 plus 8 so take a minute and pause the video and work on those examples so I'm going to use the number line technique once more so let's say negative 6 is on the last one looks at add 4 to it so 
,,we got to travel 4 spaces to the right 1 2 3 4 so this is negative 5 negative 4 negative 3 and negative 2 so therefore negative 6 plus 4 is negative 2 by the way you can reverse the numbers if you want negative 6 plus 4 is the same as positive 4 minus 6 but you have to put the positive in front now 4 minus 6 intuitively you can 
,,see that this is going to be negative 2 now what about negative 7 plus 8 that's equal to 8 minus 7 which is going to be positive 1 but let's use the number lines to 
,,confirm it so let's start with negative 7 and let's travel 8 units to the right since we're adding 8 to negative 7 1 2 3 4 5 6 7 8 this is negative 6 negative 5 negative 4 negative 3 two negative one zero positive one so negative seven plus eight is positive one go ahead and try these negative 7 plus negative five and negative three plus negative four so what is a negative seven plus negative five when you add in two negative numbers you're going to get a negative number as well 7 plus 5 is 12 negative 7 plus negative 5 that's going to be negative 12 but let's confirm it using a number line so we're going to start with negative 7 and we're going to add negative 5 to it so if you're adding a negative number you need to move towards the left if you're adding a positive number you need to travel towards the right so 
,,let's travel 5 units to the left this is negative 6 negative 5 negative 4 actually and take that back to the left the negative numbers should be getting bigger this 
,,is negative 8 negative 9 negative 10 negative 11 negative 12 so that's our answer now if 3 plus 4 is positive 7 negative 3 plus negative 4 is equal to negative 7 so 
,,now let's start with negative 3 and let's add negative 4 to it so let's travel 4 units to the left so this is negative 4 and negative 5 negative 6 negative 7 sometimes you may need to add three numbers as opposed to two numbers so what is five plus a negative three plus six five plus negative three that's equal to positive two if you have a number line and if you start with five you need to travel three units to left so going this way that's going to take you to positive two next we need to add two and six so we have to travel six units to the right started from two so this will take us to eight 2 plus 6 is 8 if you can it this is starting from 2 this 
,,is 1 2 3 4 5 6 so 2 plus 6 is 8 and that's the final answer here's another similar example what's negative 7 plus 4 plus negative 5 negative 7 plus 4 that's going to be negative 3 and negative 3 plus negative 5 whenever you're adding two negative numbers you're going to get a negative result so think of 3 plus 5 which is 8 but just add a negative sign to it so it's negative 8 now let's use the number line to confirm everything so we're going to start with negative 7 and we're going to add 4 to it 1 2 3 4 so this is negative 6 negative 5 negative 4 negative 3 so we're currently at negative 3 at this point and then we're going to add negative 5 to it so 
,,we got to go back 5 units that way so 1 2 3 4 5 so the final answer is negative 8 now let's focus on subtracting integers what is 8 minus 3 so if you're subtracting 
,,you need to travel towards the left let's start with the first number eight now we're going to travel three spaces to the left this is seven six five so eight minus 
,,three is positive five and it's just that simple so let's try 4 minus 9 so we're going to start with positive 4 we're going to travel in 9 spaces towards the left 1 
,,2 3 the 0 makes 4 5 6 7 8 9 so notice that we ended at negative 5 so 4 minus 9 is negative 5 now what is negative 3 minus 6 what is that equal to if you see a situation like this you can basically add 3 & 6 and then make it negative 3 plus 6 is 9 but this is going to be negative 9 but if this confuses you you can always just use the number line so we're going to start with negative 3 and we're going to subtract it by 6 so let's travel 6 units to left 1 2 3 4 5 6 so this is negative 4 negative 5 maybe 6 2 negative 7 negative 8 negative 9 so therefore negative 3 minus 6 is negative 9 try this one what is negative 7 minus 6 7 plus 6 is 13 so this is going to be negative 13 so let's start with negative 7 we're going to travel 6 units to the left and as you can see it's going to give us the same result now what is six 
,,minus negative four and also what's seven minus negative two whenever you have two negative signs next to each other you can make it equal to a positive sign six minus negative four is the same as 6 plus four which is 10 and 7 minus negative 2 is 7 plus 2 which is 9 now what would you do if you see a problem with three negative 
,,signs go ahead and try that now the first thing I will do is convert these two negative signs which are right next to each other into a positive sign so negative 4 minus negative 8 is equal to negative 4 plus 8 which is the same as 8 minus 4 which turns out to be 4 so using a number line I would focus on this portion now let's start with negative 4 let's add 8 to it 1 2 3 4 5 6 7 8 and as you can see we get the same final answer of positive 4 so negative 4 minus negative 8 is 4 so try a similar example what's negative 5 minus negative 6 so let's convert the two negative signs into a positive sign so this is negative 5 plus 6 which is the same as 6 minus 5 and that's positive 1 so using the number line let's add 6 to negative 5 so this is negative 4 negative 3 and this is going to go all the way to positive 1 so we're going to get the same answer so now you know how to add and subtract positive and negative integers by the way for those of you who want to find more similar videos in pre-algebra check out the description section of this video below and you can find my pre-algebra playlist
,,
Directed Numbers,Hlal9ME2Aig,"In this video, I want"
,,"to familiarize ourselves with negative numbers,"
,,and also learn a bit of how do we
,,add and subtract them. And when you first
,,"encounter them, they look like this deep"
,,and mysterious thing. When we first
,,"count things, we're counting positive numbers. What does a negative"
,,number even mean? But when we think
,,"about it, you probably have encountered negative"
,,numbers in your everyday life. And let me just give
,,you a few examples. So before I actually
,,"give the example, the general idea is"
,,a negative number is any number less than the 0. And if that sounds strange
,,"and abstract to you, let's just think about it in a"
,,couple of different contexts. If we're measuring the
,,temperature-- and it could be in Celsius
,,or Fahrenheit. Let's just assume we're
,,"measuring it in Celsius. And so, let me"
,,draw a little scale that we can measure
,,"the temperature on. And so, let's say this"
,,"is 0 degrees Celsius. That is 1 degree Celsius,"
,,"2 degrees Celsius, 3 degrees Celsius. Now let's say that it's"
,,"a pretty chilly day, and it's currently"
,,3 degrees Celsius. And someone who
,,predicts the future tells you that it
,,is going to get 4 degrees colder the next day. So how cold will it be? How can you represent
,,"that coldness? Well, if it only"
,,"got 1 degree colder, we would be at 2 degrees. But we know we have to"
,,"go 4 degrees colder. If we got 2 degrees colder,"
,,we would be at 1 degree. If we got 3 degrees
,,"colder, we would be at 0. But 3 isn't enough. We have to get 4 degrees colder. So we have to actually"
,,"go one more below the 0. And that one below 0,"
,,"we call that negative 1. And so, you can kind of"
,,"see that the number line, as you go to the right"
,,"of 0 on the number line, it increases in positive values. As you go to the left"
,,"of the number line, you're going to have negative 1. Then you're going"
,,to have negative 2. And you're going
,,to have negative 3. And you're going
,,to have-- depending on how you think
,,about it-- you're going to have larger
,,negative numbers. But I want to make it
,,very clear-- negative 3 is less than negative 1. There is less heat in
,,the air then negative 1. It is colder. There's less temperature there. So let me just
,,make it very clear. Negative 100 is much
,,"smaller than negative 1. You might look at 100,"
,,"and you might look at 1, and your gut reaction"
,,"is to say, wow, 100 is a much larger"
,,number than 1. But when you think
,,"about it, negative 100 means there's a"
,,"lack of something. If it's negative 100 degrees,"
