,,positive means the final answer is positive 12 divided by 4 that's 3 both negative means final answer is positive 15 divided by 3 is 5. 1 is positive and 1 is negative answer is negative here 21 divided by 7 is 3 1 is negative and 1 is positive answer is negative negative 5 divided by 5 5 divided by 5 is 1 1 is positive 1 is negative answer is negative 1. 20 divided by 4 is 5 both negative means answer is positive now here 8 times 2 16 both positive that's positive now you have to divide by this 16 divided by 4 that's 4. 1 is positive 1 is negative answer is negative this one we can simplify the denominator first 6 and 2 multiplication that's 12 both negative means you get positive ones now 36 divided by 12 is 3 1 is negative 1 is positive answer is negative do the numerator 5 times 4 20 one negative one positive 
,,answer is negative denominator now 2 and 2 4 both minus means positive 1's now do this one 20 divided by 4 is 5. 1 is negative 1 is positive answer is negative do the numerator 9 times 8 72 both negative means plus answer 4 times 3 12 1 is negative 1 is positive answer is negative 72 divided by 12 you get 6 1 is positive and 1 is negative answer is negative fill in each cage with the suitable directed number answer is negative that means you are getting a plus value so 20 divided by 2 you get 10. so plus 2 because minus n plus the answer is negative 18 and 6. how you get 6 18 divided by 3. now decide the sign this is plus answer is negative that means 
,,you are getting negative 3 division you get 5 that means 10 divided by 2 is 5. now decide the sign this is plus here minus so both should be minus to get plus answer answer is 4 4 divided by 1 is 4 positive and the answer is negative so this should be negative value how we decide this one when you divide this one by 2 you are getting 6. so think about reverse way so if this is 12 here 12 divided by 2 you get 6. how you get 12 from 3 this should be 4 now decide the sign this is minus and minus if it's plus and minus the answer is minus but the answer is given is plus so that means this should be a minus value so minus 4 now this one you are getting minus 28 here plus 7 is there 7 into 4 28 but this is minus means this should be minus 4 now numerator is ok now to get 7 what should be this answer you are getting minus 4 because minus minus plus 28 divided by 4 is 7. now how you get minus 4 there 2 times 2 but this is minus so you have to multiply it by minus 2. so we covered all theory related to directed numbers subtracting a number from another number is the same as adding the additive inverse of the second number to the first number a positive number is obtained when two directed numbers of the same sign are multiplied or divided a negative number is obtained when two directed numbers of opposite signs are multiplied or divided so remember all these properties in directed numbers and practice all the exercises and examples
,,
Directed Numbers,uSXcjhhBSAM,hey guys in a previous lesson we learned about the number line extended after the zero and we've introduced what we have or what we call as negative numbers now we're going to use the number line to learn how to add and subtract directed or negative numbers now at the start you're going to use the number line but after you get the hang of it you're going to become so quick and so good that you're not going to use the number line at all but it's always good always tell my students for the first couple of times that you are using and you are working with these questions even if it takes you one whole exercise or 15 or 20 or even 30 to 40 questions that you need to do using the number line there's nothing wrong with it use it and after you get the hang of it you won't need the number line again but for the start let's use the number line to get an understanding of how it actually works here we have questions and these questions involve negative or directed numbers we're going to go through one by one and you're going to see it's a very easy process using the number line and hopefully by the end of the lesson you can probably even do them without a number line as well okay let's start we have this question saying negative 4 plus 3 negative 4 plus 3 what we do we use the number line we start at negative 
,,4 so we can put our pen or au finger on negative 4 there it is and it says we have to add 3 now a quick rule to remember when we're adding we're moving towards the right we're moving towards the addition we're moving Awards towards the plus direction and if we - thing or we're taking away we're going towards the left remember that rule very important so negative 4 plus 3 we start at negative 4 and we add 3 we're going to the right because we're adding 1 2 3 our answer is negative 1 we started negative for add 3 1 2 3 as you can see I'm caning the moves one move two moves three moves so negative one is our answer then we have another example minus 2 or 
,,negative 2 plus 6 what we do first we start at negative 2 negative 2 we're adding 6 addition meaning we're going towards the right so we're adding 6 1 2 3 4 5 6 so our answer is positive 4 we don't need to write positive we just write 4 because we know 4 means positive 4 and notice when I was counting I started from negative 2 I said 1 2 I had to ensure that I add 0 I've seen students make a mistake where they just move and they go straight to the other side forgetting the 0 very important 
,,the 0 is the number we need to add it part of the process so negative 2 plus 6 1 2 3 4 5 6 our answer is 4 let's see if you can do this one where are we going to start at negative 9 so negative 9 with it says negative 9 plus 7 so we start at negative 9 add we're going towards the right and we're going to add 7 1 2 3 4 5 6 7 so our answer is negative 2 negative 9 moving 7 times we end at negative 2 minus 5 Plus 8 again we start at negative 5 or minus 5 negative 5 there we're adding 8 1 2 3 4 5 6 7 8 we are on the positive was a 3/3 that's our answer now we have something a little bit different we have negative 3 plus negative 2 negative 3 plus negative 
,,2 okay what do we do here we have a plus and a negative whenever we have a plus a negative next to each other side by side they don't like each other they don't like each other at all so what I do they're a big fight they'll fight and they're always the negative will always win the negative will always win so whenever you see a 
,,puss and Nega negative next to each other like that side by side they don't like each other they have a big fight and negative will always win so how do we do it now it becomes negative 3 minus 2 negative 3 minus 2 so we start at negative 3 and we - now we said positive or we addition we go to the right - of course we're going to go to the left - 3 minus 2 or negative 3 - 2 - 3 - 2 1 - our answer is negative 5 the number is getting smaller once again negative 4 plus in brackets negative 3 now the brackets don't get confused it is exactly the same as the top so then get confused because the brackets are there it's just telling us that there is a plus and a minus just to distinguish them sometimes you'll see the brackets sometimes you don't however disregard them - 4 + - 3 + - we said they don't like one another they have a fight so and always - we'll win so - 4 - 3 we start at minus 4 and we go back 3 1 2 3 1 - 4 1 2 3 so our answer negative 4 minus 3 is negative seven another one five plus negative six in brackets we said we disregard the bracket here we notice for a plus and a minus we know what do they do they have a fight and the minus wins so five take away six we start at five notice it's a positive five so we start at five in the positive side minus six one two three four five six at negative 
,,one so we go to the left because we're taking away and our answer is negative one five take away six is negative 1 then we have 7 plus negative seven again a plus and a minus next to each other they don't like one another they have a fight - will always win 7 take away 7 I mean it's too easy but we'll still use the number line we start at 7 minus 7 so 1 2 3 4 5 6 7 obviously our answer is going to go and become nothing zero 7 take away 7 is zero so this is the basics of how to use a number 
,,line to add or subtract directed numbers we're going to do a couple more examples that way you get the hang of it and by now you should already have a very good understanding of how to solve these number sentences using the number line and hopefully you probably even now see the pattern where you don't even need the number line 
,,at all now that we know how to use a number line we can actually solve a little bit more harder questions let's see how they're done in this example we have negative 3 minus and in brackets negative 3 plus 5 we know that we have to use brackets of division multiplication addition and subtraction we still have to follow that order in all our number sentences now here we noticed we have brackets so we have to complete what's in the brackets first before we go outside in the brackets we have negative 3 plus five so using the rules negative three plus five where do we start we start at negative three we add five we're going to the right one two three four 
,,five our answer is two now negative three minus two we start at negative three and we - two one two so answer in full negative five minus three minus two is negative five we start from the brackets and we move on here we have nine plus in brackets negative two minus six closed bracket so we follow the order of operations which shows that we have to do the brackets first to do that negative six my or minus two minus six we start at negative 2 and we minus 6 1 2 3 4 5 6 so negative 8 then 9 plus negative 8 9 plus negative 8 we notice a plus and a minus next to each other and we know they don't like one another they have a fight - will always win so it's 
,,9 take away 8 9 take away 8 1 2 3 4 5 6 7 8 and of course the insert is 198 now answer here is one one last example negative six plus in brackets 2 times 5 again order of operations States we have to complete the brackets first so 2 times 5 is 10 negative six plus 10 so we start at negative six we add 10 so we get to the right one two three four five six seven eight nine ten our answer is positive four or just four so here we've done three examples where we do need to use the order of operations but exactly if we follow the steps we follow the process we won't go wrong the more practice you do with the number line you get the hang of it and hopefully later on you won't even need the number line at all
,,
Directed Numbers,sEU5uaf-Tu4,hello John Zimmerman from Taba class comm and what I want to do here in this video is just quickly go over the rules for positive and negative numbers many of you out there may know and maybe you've experienced yourself your solutions your math solutions you know becoming incorrect because you messed up on one of these integer rules one of these rules that involve positive and negative numbers it's just so easy too easy to confuse some of these rules but you absolutely have to learn these to really master you know middle school and high school mathematics let's just go through very quickly and we'll start with the easy stuff first I want to take a look at the multiplication rules okay so here anytime you're multiplying two numbers where the signs the signs are the same in other words a positive times a positive or negative times a negative okay the answer is always positive okay so two times positive two times positive eight positive 16 okay so once again negative two times negative eight the signs are the same I both negative positive answer positive 16 now in multiplication when you're multiplying two numbers and where one of the signs are opposite ie ones pause and ones negative here I have a positive times a negative doesn't make a difference it could be a negative times a positive the product the answer is going to be negative okay so that's multiplication right there and these are the multiplication rules now division is the same thing okay so multiplication and division pretty straightforward so 16 divided by 4 of course will be a positive 4 negative 16 divided by a negative 4 would be okay once again signs are the 
,,same so the answers gonna be positive that's a positive 4 and now here I have a negative 16 divided by a positive 4 right opposite signs so the answer ok is going to be negative negative 4 alright so this is the easy stuff now let's get to the more challenging or what seems to give students I think a little bit more problems understanding Nishal e is addition now I'm going to kind of change colors here I'm going to tell you if you know how to add positive negative numbers then you'll be able to subtract and you'll see what I'm talking about here in a second all right so eight plus two K two positives the signs are the same okay so you keep the sign obviously it's gonna be a positive ten right all of us probably knew that now let's take a look at this okay we have a negative eight plus a negative two the signs are 
,,the same so you're going to add these values right here and you're going to keep the same sign so this is going to be negative ten all right so right here when you're adding numbers with the same sign you could tell we're just adding adding the numbers and keeping the sign so no problem there here's where it gets a little interesting to think for students right here we have we're adding two numbers with different signs so we have a negative eight plus a two all right so let me ask you which number here don't look at the sign just look at the positive version of the number which one is larger okay the eight or the - all right well clearly this one would be large we call that the absolute value but I don't want I don't want to throw out too many technical terms here okay so between the eight and a two we said that eight is a larger number okay we think of it as a larger number that's positive version and you can tell they here that a has the negative sign so here's what you do 
,,anytime you have two different signs okay you're going to end up subtracting alright so let's actually do that now okay eight and two if I took the difference I'm going to get six right I just kind of forget about that negative sign for a second but now the sign that is associated with the answer is going to have or you're going to be associated with that largest number ie the eight okay so this is you be a negative six all right so it makes sense let's let's try another one here so we have eight plus and negative two okay the signs are different so when the signs are different you're going to end up subtracting okay so subtract just the whole version 
,,or the positive versions of these numbers okay eight and two so if I just told you to subtract them or find the difference you would say okay that's six now out of the eight and two which one has a larger sign or which one is the larger number the eight is a larger number and this eight right here is a positive eight so my answer is going to be a positive six okay all right so once again I'm just kind of quickly trying to refresh some of these rules and of course you know in a few minutes I would expect you to master all this stuff but hopefully this is making sense to most you out there all right so let's talk about subtraction okay here's a deal with subtraction I said if you know how to add you could subtract positive negative numbers so what we're going to do with subtraction problems is turn them into addition problems by doing something called plus negative so here I have 7 minus 10 what I want you to do is to take that subtraction sign and you're going to turn it into 
,,an addition sign and they're going to put that little negative sign and attack it on to the number to the right of that of that addition symbol okay so you see what 
,,I did there I said seven instead of 7 minus 10 I'm going 7 plus negative 10 and then now of course I'm going to go ahead and do this addition problem the signs are different so I'm going to subtract the numbers okay and then here 10 is the larger number and it has a negative sign so I'm going to go ahead and make that a negative 3 for my answer okay and by the way too what I'm trying to do is just give you kind of a procedural some rules here I'm trying to teach you all the concepts involved in integers which are very important by the way just trying to get you some simple rules so you don't mess this up when you're actually doing calculations okay let's take a look at this last one in here we have 3 minus a minus 6 so I'm going to go ahead and turn this into a positive or excuse me an addition problem and then I'm going to tack on out negative sign to the number to the right but now I have a negative of a negative 6 or the opposite of a negative 6 okay so if I told you what's the opposite of negative 6 you would say oh that's positive six this really turns into this problem three plus a positive six or three plus six and that is nine okay so pretty much a real fast review listen if you need a lot more information on this and other topics come on over to tablet class comm we have a 30 day free trial tons of stuff we have full courses the whole idea with our products it's clear and understandable we we really design our lessons to be explained and that's the key word explained not taught down too but explain in a way that you understand so hopefully and come over and check us out at Taba class comm take one hour 30 day free trials and learn and master this stuff so your headaches and mathematics go away good luck to yourself
,,
Directed Numbers,NybHckSEQBI,"Hi! This is Rob. Welcome to Math Antics. In this lesson, we're going to learn some really important things about a whole branch of math called Algebra. The first thing you need to know is that Algebra is a lot like arithmetic. It follows all the rules of arithmetic and it uses the same four main operations that arithmetic is built on: addition, subtraction, multiplication and division. But Algebra introduces a new element... the element of the unknown. When you were learning arithmetic, the only thing that was ever unknown was the answer to the problem. For example, you might have the problem 1 + 2 = what? The answer isn't known until you go ahead and "
,,"do the arithmetic. Now the important thing about Algebra is that when we don't know what a number is yet, we use a symbol in its place. that symbol is usually just any letter of the alphabet. A really popular letter to choose is the letter 'x'. So in arithmetic, we would just leave the problem like this: 1 + 2 = ""blank"" and we'd write in the answer when we did the addition. But in Algebra, we'd write it like this:  1 + 2 = x The 'x' is a place holder that stands for the number that we don't know yet. What we have here is a very basic algebraic equation. An equation is just a mathematical statement that two things are equal. An equation says, ""the things on this side of the equal sign have the same value as the things on the other side of the equal sign."" In this case, our equation is telling us that the known values on this side (1+2) are equal to what's on the other side, which happens to be the unknown value that we are calling 'x'. One of the main goals in Algebra is to figure out what the unknown values in equations are. And when you do that, it's called ""solving the equations"". In this equation, it's pretty easy to see that the unknown value is just 3. All you have to do is actually add the 1 and 2 together on this side of the equation and it turns into 3 = x, which is the same as x = 3. So now we know what 'x' is!  It's just 3. That almost seems too easy, doesn’t it? And that's why in Algebra, you are usually given an equation in a more complicated form like this: x - 2 = 1. This is exactly the same equation as 1 + 2 = x, but it has been rearranged so that it's not quite as easy to tell what 'x' is. So in Algebra, solving equations is a lot like a game where you are given mixed-up, complicated equations, and it's your job to simplify them and rearrange them until it is a nice simple equation (like x = 3) where it's easy to tell what the unknown values are. We're going to learn a lot more about how you actually do that (how you solve equations) in the next several videos, but for now, let's learn some important rules about how symbols can and can't be used in algebraic equations. The first rule you need to know is that the same symbol (or letter) can be used in different algebra problems to stand for different unknown values. For example, in the problem we just solved, the letter 'x' was used to stand for the number 3, right? But 'x' could stand for a different number in a different problem. Like, if someone asks us to solve the equation, 5 + x = 10. In order for the two sides of this equation to be equal, 'x' must have the value '5' in this problem, because 5 + 5 = 10. So 'x' (or any other symbol) can stand for different values in different problems. That's okay, but what's NOT okay is for a symbol to stand for different values in the same problem at the same time! For example, what if you had the equation: x + x = 10? This equation says that if we add 'x' to 'x' we will get 10. And there are a lot of different numbers we could add together to get 10, like 6 and 4. But, if we had the first 'x' stand for 6 and the second 'x' stand for 4, then 'x' would stand for two different value at the same time and things could get really confusing! If you wanted symbols to stand for two different numbers at the same time, you would need to use two different symbols, like 'x' and 'y'. So in Algebra, whenever you see the same symbol repeated more than once in an equation, it's representing the same unknown value. Like if you see a really complicated Algebraic equation (like this), where 'x' is repeated a lot of different times, all of those 'x's stand for the same value, and it will be your job to figure out what that value is. Okay, so for any particular equation, we can't use the same letter to represent two different numbers at the same time, but what about the other way around? Could we use two different letters to represent the same number? Yes! - Here's an example of that. Let's say you have the equation: a + b = 2 What could 'a' and 'b' stand for so that the equation is true? Well, If 'a' was 0 and 'b' was 2, then the equation would be true. Or, we could switch them around. If 'a' was 2 and 'b' was 0, the equation would also be true. But there's another possibility: If 'a' was 1 and 'b' was also 1, that would make the equation true, right? So, even though 'a' and 'b' are different symbols, and would usually be used to represent different numbers, there are times when they might happen to represent the same number. Oh, and this problem can help us understand something very important about how symbols are used in Algebra. Did you notice that there were different possible solution for this equation? In other words, 'b' could have the value 0, 1, or 2 depending on what the value of 'a' was. If 'a' is 0 then 'b' must be 2 If 'a' is 1 then 'b' must be 1 If 'a' is 2 then 'b' must be 0 'b' can't have two different values at the same time, but it's value can change over time if the value of 'a' changes. In Algebra, 'b' is what's called a ""variable"" because it's value can 'vary' or change. In fact, in this equation, both 'a' and 'b' are variables because their values will change depending on the value of each other. Actually, it's really common in Algebra to refer to any letter as a variable, "
,,"since letters can stand for different values in different problems. But at Math Antics, we'll usually just use the word ""variable"" when we're talking about values that can change or vary in the same problem. Alright, so far we've learned that Algebra is a lot like arithmetic, but that in includes unknown values and variables that we can solve for in equations. There's one other really important thing that I want to teach you that will help you understand what's going on in a lot of Algebra "
,,"problems, and it has to do with multiplication. Here are the four basic arithmetic operations: addition, subtraction, multiplication and division. Although in Algebra, you'll usually see division written in fraction form, like this. In Arithmetic, all four operations have the same status, but in Algebra, multiplication get's some special treatment. In Algebra, multiplication is the 'default' operation. That means, if no other arithmetic operation is shown between two symbols, then you can just assume they're being multiplied. The multiplication is 'implied'. For example, instead of writing 'a' times 'b', you can leave out the times symbol and just write 'ab'. Since no operation is shown between these two symbols, you know that you're supposed to multiply 'a' and 'b'. Of course, you can't actually multiply 'a' and "
,,"'b' until you figure out what numbers they stand for. The advantage of this rule about multiplication is that it makes many algebraic equations less cluttered and easier to write down. For example, instead of this: a * b + c * d = 10 You could just write: ab + cd = 10. You can also use this shorthand when you are multiplying a variable and a known number... like 2x, which means the same thing as 2 times 'x' or 3y which means the same thing as 3 times 'y' Since the symbol and the number are "
