,,"form the number 64 which is divisible by 4 thus the whole number 164 is divisible by 4 divisibility by 5 if the number ends in 5 or 0 we say that the given number is divisible by 5 for example 525 ends in 5 thus it is divisible by 5 look at this another example 330 ends in 0 hence it is also divisible by 5 divisibility by 6 if the number is divisible by both 2 and 3 we see that the given number is divisible by 6 for example look at the number 408 is it divisible by 2 the number ends in 8 thus it is divisible by 2 is it divisible by 3 4 plus 0 plus 8 is equal to 12 which is divisible by 3 which makes the number 408 divisible by 3 as well hence 408 is divisible by 6 divisibility by 8 if the number formed by the last three digits of the given number is divisible by 8 we see that the given number is divisible by 8 for example look at the number 50 3888 its last three digits form the number 8 on eighty-eight which is divisible by 8 thus 53,000 888 is divisible by 8 divisibility by nine if the sum of the digits of the number is divisible by nine we see that the given number is divisible by nine for example look at the number seven lakh twenty "
,,nine thousand six hundred thirty-nine here on adding the digits seven two nine six three and nine we get the sum as 36 which is divisible by nine thus seven lakh twenty nine thousand six hundred thirty-nine is also divisible by nine finally let us look at divisibility by ten if the number ends in a zero we say that the given number is divisible by ten for example 8620 ends in zero thus it is divisible by ten kids now it is time for you to remember all these divisibility tests and find out the answer
,,
Directed Numbers,mOQAOVqJBZQ,nouns concrete and abstract anything that you can see touch smell taste or here is concrete concrete nouns are words that refer to object that we can experience with our five senses that is by seeing smelling hearing tasting and touching for example a mountain can be seen incense sticks can be smelled a trumpet can be heard noodles can be tasted rain can be touched such Mountain incense sticks trumpet noodles and rain are concrete nouns abstract nouns are opposite of concrete nouns they can only be thought of or felt they cannot be seen or touched for example an idea is a thought happiness is a feeling thus idea and Happiness are abstract nouns an abstract noun refers to qualities actions and state of being for example kindness is a quality laughter is an action beauty is a state of being in short abstract nouns are words that mean ideas feelings experiences qualities and concepts many abstract nouns are formed by adding suffixes for example dry Ness dryness mother hood motherhood some abstract nouns end in Y dy or ity for example joy beauty responsibilities some abstract nouns end in IO n tion or a tion for example collection destruction admiration
,,
Directed Numbers,3YwrcJxEbZw,"To understand what real numbers are, all you need to understand is the number line. Positive numbers to the right of Zero. And negative numbers to the left of Zero. "
,,"You will hear various complicated definitions of real numbers but here's the simplest one. Any number, that can be plotted on a number line is called a real number. "
,,"Let's look at a few examples. Say 'minus 2.' Yes, it can be plotted on the number line. It's this point. So minus two is a real number. What about zero point five? Even though it's not an integer, it can be plotted on the number line. It will be somewhere here. Now let's look at another number. Root two. Which is also called as "
,,"square root of two. If we calculate the value of root two, we get it as 1.414 approximately. The digits after the decimal point do not end. These kind of numbers are called non-terminating decimal numbers. And yes, these numbers too can be plotted on the number line. Plotting a non-terminating number might sound weird, but yes, "
,,"it's possible. So 'root two' is also a real number. And what about the special number Pi? it approximately equals 3.14159. Pi is also a non-terminating decimal number. And yes, it can be plotted on the number line, which makes it a real number. So that's our definition. Any number that can be plotted on a number line is called a real number. Now let's talk a bit about the different kinds of numbers we know. The first kind is numbers with terminating decimals. Numbers like 0.375. The number "
,,"stops at a point and does not go on and on. Then we have non-terminating recurring decimals. Numbers like 0.6666 and so on. The sixes don't end. It's called recurring since the same number reoccurs and non-terminating since it reoccurs infinitely. And the third type is non-terminating non-recurring decimals. We just saw an example of this type. Root two. It approximately equals 1.4142. And the digits after the decimal do not end. Hence, it's called non-terminating. It's called non-recurring , since there is no specific pattern of re-occurrence. Broadly, these are the three types of numbers we see in Mathematics. 'Terminating', 'non-terminating recurring'and 'non-terminating non-recurring'. These two categories together are called Rational numbers. and the numbers in this category are called Irrational numbers. These two categories together form Real numbers. This is the other definition of Real numbers. Rational numbers and Irrational numbers together form Real numbers. In the second part of this video, we will look at all categories real numbers comprise off."
,,
Directed Numbers,A_LOsCaRzNA,hewlett to our planet Earth weather and climate weather weather is the condition of the atmosphere off a place at a particular time the weather of a place can change rapidly it may be bright and sunny with a clear sky in the morning while in the evening the sky may be covered with dark clouds it may start raining in the morning 
,,but the afternoon may be bright and sunny the weather of a particular place depends on the temperature the moisture in the air the pressure of air the movement of air event temperature temperature is the extent of hotness and coolness of a place the earth gets heated by the Sun as the sunlight reaches the earth the land and the 
,,Seas heat up and warm the atmosphere this swarming up of the atmosphere raises the temperature moisture of water vapour is always present in the air the amount of moisture in the air rises when the sun's heat converts water from the oceans seas rivers and lakes into water vapour this is the reason why coastal areas get more rainfall than places away from the coast air pressure is the weight of air has experienced from all directions on land when air heats up it rises and creates an area of 
,,low pressure on the Earth's surface the surrounding cool air moves in to replace this rising air this air comes from areas where the pressure is high this movement of air from high pressure area to low-pressure area causes win the wind is sometimes a light pleasant breeze at other times it can be very strong and can cause a storm or a hurricane climate climate is the weather condition of an area over a long period of time climate of a place depends on its average monthly or yearly temperature average amount of rainfall or snow climate influences the type of food people grow and eat the type of clothes they wear the type of homes they live in the types 
,,of plants that grow and animals that can live in the region seasons the seasons of the earth occur because of the rotation of the earth on its axis and revolution around the Sun there are mainly three seasons in India summer monsoon and Richter summer from March onwards it grows hot March April and May are the summer months monsoon from the month of June rain clouds gather in the sky bringing rain to most parts of India the rains continue till the end of September June July August and September are rainy months Victor after the rains the weather becomes drier and cooler October November December January and February of winter months January is the coldest month seasons change in an orderly fashion this change of seasons from summer to monsoon to winter is called the cycle of seasons
,,
Directed Numbers,uSXcjhhBSAM,hey guys in a previous lesson we learned about the number line extended after the zero and we've introduced what we have or what we call as negative numbers now we're going to use the number line to learn how to add and subtract directed or negative numbers now at the start you're going to use the number line but after you get the hang of it you're going to become so quick and so good that you're not going to use the number line at all but it's always good always tell my students for the first couple of times that you are using and you are working with these questions even if it takes you one whole exercise or 15 or 20 or even 30 to 40 questions that you need to do using the number line there's nothing wrong with it use it and after you get the hang of it you won't need the number line again but for the start let's use the number line to get an understanding of how it actually works here we have questions and these questions involve negative or directed numbers we're going to go through one by one and you're going to see it's a very easy process using the number line and hopefully by the end of the lesson you can probably even do them without a number line as well okay let's start we have this question saying negative 4 plus 3 negative 4 plus 3 what we do we use the number line we start at negative 
,,4 so we can put our pen or au finger on negative 4 there it is and it says we have to add 3 now a quick rule to remember when we're adding we're moving towards the right we're moving towards the addition we're moving Awards towards the plus direction and if we - thing or we're taking away we're going towards the left remember that rule very important so negative 4 plus 3 we start at negative 4 and we add 3 we're going to the right because we're adding 1 2 3 our answer is negative 1 we started negative for add 3 1 2 3 as you can see I'm caning the moves one move two moves three moves so negative one is our answer then we have another example minus 2 or 
,,negative 2 plus 6 what we do first we start at negative 2 negative 2 we're adding 6 addition meaning we're going towards the right so we're adding 6 1 2 3 4 5 6 so our answer is positive 4 we don't need to write positive we just write 4 because we know 4 means positive 4 and notice when I was counting I started from negative 2 I said 1 2 I had to ensure that I add 0 I've seen students make a mistake where they just move and they go straight to the other side forgetting the 0 very important 
,,the 0 is the number we need to add it part of the process so negative 2 plus 6 1 2 3 4 5 6 our answer is 4 let's see if you can do this one where are we going to start at negative 9 so negative 9 with it says negative 9 plus 7 so we start at negative 9 add we're going towards the right and we're going to add 7 1 2 3 4 5 6 7 so our answer is negative 2 negative 9 moving 7 times we end at negative 2 minus 5 Plus 8 again we start at negative 5 or minus 5 negative 5 there we're adding 8 1 2 3 4 5 6 7 8 we are on the positive was a 3/3 that's our answer now we have something a little bit different we have negative 3 plus negative 2 negative 3 plus negative 
,,2 okay what do we do here we have a plus and a negative whenever we have a plus a negative next to each other side by side they don't like each other they don't like each other at all so what I do they're a big fight they'll fight and they're always the negative will always win the negative will always win so whenever you see a 
,,puss and Nega negative next to each other like that side by side they don't like each other they have a big fight and negative will always win so how do we do it now it becomes negative 3 minus 2 negative 3 minus 2 so we start at negative 3 and we - now we said positive or we addition we go to the right - of course we're going to go to the left - 3 minus 2 or negative 3 - 2 - 3 - 2 1 - our answer is negative 5 the number is getting smaller once again negative 4 plus in brackets negative 3 now the brackets don't get confused it is exactly the same as the top so then get confused because the brackets are there it's just telling us that there is a plus and a minus just to distinguish them sometimes you'll see the brackets sometimes you don't however disregard them - 4 + - 3 + - we said they don't like one another they have a fight so and always - we'll win so - 4 - 3 we start at minus 4 and we go back 3 1 2 3 1 - 4 1 2 3 so our answer negative 4 minus 3 is negative seven another one five plus negative six in brackets we said we disregard the bracket here we notice for a plus and a minus we know what do they do they have a fight and the minus wins so five take away six we start at five notice it's a positive five so we start at five in the positive side minus six one two three four five six at negative 
,,one so we go to the left because we're taking away and our answer is negative one five take away six is negative 1 then we have 7 plus negative seven again a plus and a minus next to each other they don't like one another they have a fight - will always win 7 take away 7 I mean it's too easy but we'll still use the number line we start at 7 minus 7 so 1 2 3 4 5 6 7 obviously our answer is going to go and become nothing zero 7 take away 7 is zero so this is the basics of how to use a number 
,,line to add or subtract directed numbers we're going to do a couple more examples that way you get the hang of it and by now you should already have a very good understanding of how to solve these number sentences using the number line and hopefully you probably even now see the pattern where you don't even need the number line 
,,at all now that we know how to use a number line we can actually solve a little bit more harder questions let's see how they're done in this example we have negative 3 minus and in brackets negative 3 plus 5 we know that we have to use brackets of division multiplication addition and subtraction we still have to follow that order in all our number sentences now here we noticed we have brackets so we have to complete what's in the brackets first before we go outside in the brackets we have negative 3 plus five so using the rules negative three plus five where do we start we start at negative three we add five we're going to the right one two three four 
,,five our answer is two now negative three minus two we start at negative three and we - two one two so answer in full negative five minus three minus two is negative five we start from the brackets and we move on here we have nine plus in brackets negative two minus six closed bracket so we follow the order of operations which shows that we have to do the brackets first to do that negative six my or minus two minus six we start at negative 2 and we minus 6 1 2 3 4 5 6 so negative 8 then 9 plus negative 8 9 plus negative 8 we notice a plus and a minus next to each other and we know they don't like one another they have a fight - will always win so it's 
,,9 take away 8 9 take away 8 1 2 3 4 5 6 7 8 and of course the insert is 198 now answer here is one one last example negative six plus in brackets 2 times 5 again order of operations States we have to complete the brackets first so 2 times 5 is 10 negative six plus 10 so we start at negative six we add 10 so we get to the right one two three four five six seven eight nine ten our answer is positive four or just four so here we've done three examples where we do need to use the order of operations but exactly if we follow the steps we follow the process we won't go wrong the more practice you do with the number line you get the hang of it and hopefully later on you won't even need the number line at all
,,
Directed Numbers,f4c8izcEX4s,hello graduate children today i'm here to teach you chapter four in your textbook that's directed numbers we can call it directed numbers as well so we'll see what are the basics here what is this one what what you call this one this is a number line so starting point is 0 and then towards the right hand side you get positive numbers towards left hand side you get negative numbers so 0 plus 1 plus 2 plus 3 plus 4 like that towards this side to the right side minus 1 minus 2 minus 3 to the left side of 0. what about in between in between means any decimals or fractions in between the whole numbers but only we mark the integers half 0.5 is in between 0 and 1. so any fraction or decimal in between the integers now what are these plus 1 plus 1.2 plus 3.5 these are directed numbers there's a direction that's why we use plus or minus so here it's better to write directed numbers in brackets because we can see that whether it's towards positive side or towards negative side now here use plus for addition and subtraction we use minus sign so therefore it is better to write directed numbers in brackets so here minus 3 means to the left side of 0 
,,3 units to the left plus 8 means towards right hand side plus 5 towards right hand side minus 4 towards left hand side so when you want to show directed numbers sign is important and make sure that you put brackets now what are the properties in directed numbers magnitude and the direction so what is magnitude means the size of 
,,the directed number just a number direction means whether it's positive or negative so consider plus 3 what's the magnitude there you take only the number plus 3 that is the distance on the number line from 0 to plus 3 this is towards right hand side plus sign represent the number is in the right hand side to zero consider minus five directed number what's the magnitude there magnitude is five so what's the meaning of that magnitude 5 means starting from 0 to -5 distance from 0 to -5 and minus means the number is in the left hand side to zero write down the magnitude and the direction for given directed numbers plus seven so what's the magnitude 7 what's the direction plus plus means to the right minus 8 magnitude is 8 minus means to the left of 0 plus 4 4 is the magnitude this is to the right and minus 10 10 is the magnitude this is to the left 0 that's not moving so magnitude 0 and what's the direction none not moving left or right minus six means six is the magnitude minus means to the left plus 12 plus 12 means magnitude is 12 and plus means to the right now look at this one numbers with the same magnitude and opposite signs are located in equal distance from zero when you add these the answer is zero now what it means now take this one so here i can start minus 3 minus 2 minus 1 0 1 2 3 4 5 like that minus 3 what it means 0 to minus 3 distance plus 3 means 0 to right hand side distance so these two distances are the same when you add what happens opposite 
,,sides get cancel out and you get 0 if this is plus 7 to get 0 you need to add minus 7. if this is 0 plus 8 is there that means you have to add minus a and if this is minus 10 is there you have to add plus 10 to get 0. so we call it's the additive inverse additive inverse means if you take plus 3 minus 3 is the additive inverse of plus 3. now if you take plus 7 what's the additive inverse that's minus 7 minus 12 what's the additive inverse of minus 12 that's plus 12 when you add these you get zero addition of directed numbers so what we do so plus 2 plus 5 so we can start from plus 2 in grade 7 you did starting with 0. now we can start with plus 2. so plus 2 is there here and adding plus 4 so straight away 4 units from here 1 2 3 4 so the answer you are getting here is the final answer so what is plus 2 plus 4 that's plus 6 so the answer is plus 6. start from plus 2 and move 4 places to the right answer is obtained from the last position on the number line let's take this one 
,,minus 3 so start with -3 plus plus means to the right and plus 4 means you are moving 4 places to the right 1 2 3 4 so you're moving to this side so what's minus 3 plus 4 answer is plus 1 this one negative 2 plus negative 3 so starting from negative 2 and adding negative 3 adding means to the right but you are subtracting here another minus three now again you have to go back to left so another three one two three to the left side so what's the final answer minus 2 adding 3 places to the left so final answer is minus 5. so start from minus 2 and move 3 places to the left answer is obtained from the position on the number line find minus 4 plus 7 so starting from minus 4 plus seven that means moves to the right seven places one two three four five six seven so here to here so what's the final position plus 3 here 2 this is 3 so plus 3 is the answer this one plus seven and minus eight so here plus seven starting point is plus seven adding and here minus eight so minus means you have to move eight places to the left one two three four five six seven eight so this is the final position so what's the answer minus one plus 4 plus minus 7 so starting point is plus 4 plus and minus 7 means moves 7 places to the left so what's the answer 1 2 3 4 5 6 7 so here 2 here so the final position is minus 3 write down the answer at once now all are positive and addition so what you do just add the numbers and put the sign positive both numbers are positive answer is also positive and value is the sum of the two numbers so you can do at once 5 plus 3 8 sine is positive 7 plus 2 9 sine is positive 6 plus 4 10 sine is positive 8 plus 6 fourteen sign is positive nine plus one ten sign is positive and four plus four eight sine is positive write down the answer at once now what happens you get both negatives and addition sign is there so what we do both numbers are negative answer is also negative and the value is the sum of the two numbers if both are negative just add it 3 plus 2 5 but the sign is negative 5 and 3 8 here negative 7 plus 6 13 negative 30 5 and 5 10 that's negative 10 9 plus 2 11 that's negative 11 and four plus four eight that's negative eight write down the answer at once now what happens one is positive and the other one is negative so what we do here addition of directed numbers with opposite signs ignore the sign and take the difference between the two values sine of the answer is always the sign of the larger number so what we do take the difference 7 and 2 difference is 5. and which one is a bigger plus 7 so the answer is plus 5. 6 and 3 difference is 3 positive 6 is the bigger one it's plus 3 10 and 4 what's the difference 6 but large number is negative so negative 6 here 11 and 8 what's the difference 3 large number is positive so you put positive 3 subtraction of directed numbers now you are asked to find out plus 4 minus minus 2 using number line so what's the starting value plus 4 here subtraction is left and minus 2 you need to get the opposite direction so that means plus 2 so 2 places to the right so you get 6 is the answer so we can write plus 4 minus minus 2 is plus 6. this one find minus 3 minus minus 5 using number line so minus 3 is the starting point minus means left subtraction and minus 5 you have to consider the opposite that means five places to the right one two three four five so you get plus two so minus three minus minus five is plus 2. find the answer using number line so starting value is plus 3 minus minus means left here plus 4 so left 4 places 1 2 3 4 so you get this number so what's the answer minus 1. 5 minus minus 7 start with minus 5 okay so these are all positive numbers and here minus is left and another minus means opposite direction seven places to the right one two three four five six seven so you get plus 2 as the answer so make sure that you put brackets so the answer is plus 2. this one plus 4 is the starting point minus plus 6 means 6 places to the left 1 2 3 4 5 6. 6 places to the left the final as is minus 2 so you can write -2 there zero minus minus four what's the starting value zero and here minus and another minus get cancel out so you are moving four places to the right one two three four what's the final answer you get plus four so here also plus four is the answer this one 0 that means starting point is 0 minus plus 5 means moves 5 places to the left 1 2 3 4 5. you get minus 5 so what's the answer minus 5 is the directed number plus 2 minus plus 4 starting value is plus 2. this is all positive and minus to the left 4 units 1 2 three four so here this way so the answer is minus two write down the answer at once now you know what you have to do so here 7 and these all this is positive both positive and the subtraction just subtract 7 minus 5 plus 2 8 minus 4 what's 8 minus 4 plus 4 10 minus 6 you get 4 and this is plus 4 9 and plus 5 difference is 4 and this is plus 4 6 and 4 subtraction you get plus 2 11 and 9 
,,you need to subtract 11 minus 9 2 11 minus 9 is 2 that's plus 2 this side minus 3 and plus 4 now so here difference is 1 and look at this one so you have to add starting from minus 3 move 4 places to the left again so what's the answer 4 and 3 you get 7 that's minus 7 this one starting from minus 5 moves 9 places towards left side 9 plus 5 14 that's minus starting from minus 10 you are moving 12 places again to the left side so you are adding these two numbers so 22 and this is minus 8 and 
